{
  "id": "midiusb-mcp23017-piano",
  "name": "MidiUSB MCP23017 Piano",
  "shortName": "Simple USB Piano",
  "type": "archive",
  "summary": "Inactive minimal Arduino Leonardo piano controller using eight MCP23017 expanders and 88 solenoid outputs.",
  "description": "A deliberately simple USB-MIDI piano implementation reacting only to Note On/Off, without velocity control or advanced MIDI handling.",
  "repository": {"owner":"glloq","name":"MidiUSB-MCP23017-Piano","url":"https://github.com/glloq/MidiUSB-MCP23017-Piano","visibility":"public"},
  "status": {"maturity":"archived","software":"implemented","hardware":"unknown","documentation":"documented","gmb":"unknown"},
  "families": ["keyboard"],
  "supportedInstruments": ["piano"],
  "controller": {"boardIds":["arduino-leonardo"],"notes":[]},
  "midi": {"transports":[{"id":"usb-midi","status":"implemented","direction":"input"}],"messages":["note-on","note-off"]},
  "gmb": {"state":"none","protocolVersion":null,"automaticDiscovery":false,"capabilityDescriptor":false,"changeNotification":false,"notes":[]},
  "mechanics": {"summary":"One output per piano key drives a corresponding electromagnet/solenoid.","axes":0,"requires3dPrinting":null,"requiresLaserCutting":null,"requiresCnc":null,"requiresWoodworking":null,"calibrationRequired":false,"homingRequired":false,"notes":[]},
  "actuators": [{"typeId":"solenoid","quantity":88,"role":"Actuate piano keys","driver":"ULN2803/ULN2804 from MCP23017 outputs","notes":null}],
  "drivers": ["MCP23017","ULN2803","ULN2804"],
  "sensors": [],
  "power": {"supplies":[],"notes":[]},
  "capabilities": {"noteRange":{"min":21,"max":108},"polyphony":null,"velocity":false,"aftertouch":false,"pitchBend":false,"supportedCC":[]},
  "build": {"difficulty":"advanced","estimatedCost":null,"estimatedBuildTimeHours":null,"tools":[]},
  "resources": [{"kind":"repository","label":"GitHub repository","url":"https://github.com/glloq/MidiUSB-MCP23017-Piano"}],
  "documentation": [{"kind":"readme","label":"Project README","url":"https://github.com/glloq/MidiUSB-MCP23017-Piano/blob/main/README.md"}],
  "firmware": {"available":true,"buildSystems":["Arduino IDE"],"sourcePath":null,"environments":[]},
  "flash": {"supported":false,"targets":[]},
  "postFlash": {"localUrl":null,"setupSsidPattern":null,"steps":[]},
  "media": {"thumbnail":null,"images":[],"videos":[]},
  "relations": {"replaces":[],"replacedBy":[],"related":["playmode-gmb","orchestrion-piano"]},
  "license": null,
  "warnings": ["Repository explicitly marks this project as no longer active.","No velocity or advanced MIDI control is implemented."]
}