{
  "id":"servo-flute-v3","name":"Servo Flute V3","shortName":"Servo Flute V3","type":"legacy","summary":"Arduino Leonardo/Micro robotic flute with six finger servos, airflow servo, breath-controller support and optional microphone calibration.","description":"The pre-GMB Servo Flute generation documents an Irish-flute-style 6-hole build with expressive airflow control, calibration helpers and optional INMP441 acoustic feedback.","repository":{"owner":"glloq","name":"servo-flute","url":"https://github.com/glloq/servo-flute","visibility":"public"},"status":{"maturity":"legacy","software":"implemented","hardware":"unknown","documentation":"documented","gmb":"unknown"},"families":["wind"],"supportedInstruments":["irish-flute","six-hole-flute"],"controller":{"boardIds":["arduino-leonardo","arduino-micro"],"notes":[]},"midi":{"transports":[{"id":"usb-midi","status":"implemented","direction":"input"}],"messages":["note-on","note-off","control-change","breath-controller"]},"gmb":{"state":"none","protocolVersion":null,"automaticDiscovery":false,"capabilityDescriptor":false,"changeNotification":false,"notes":[]},"mechanics":{"summary":"Six servos close the flute holes, a seventh servo controls airflow, and a solenoid is used in the air system. Printed finger/support and valve parts are documented.","axes":0,"requires3dPrinting":true,"requiresLaserCutting":null,"requiresCnc":null,"requiresWoodworking":true,"calibrationRequired":true,"homingRequired":false,"notes":["Repository documents 14 playable notes and servo initialization/calibration procedures."]},"actuators":[{"typeId":"servo","quantity":7,"role":"Six fingers plus airflow control","driver":"PCA9685","notes":null},{"typeId":"solenoid","quantity":1,"role":"Air/valve actuation","driver":"MOSFET + flyback diode","notes":"README suggests 5/6 V, at least 2 N and preferably low current."}],"drivers":["PCA9685","MOSFET stage"],"sensors":["INMP441 microphone optional"],"power":{"supplies":[{"label":"Servo/control supply","voltageV":5,"currentA":5,"notes":"README minimum."}],"notes":[]},"capabilities":{"noteRange":null,"polyphony":1,"velocity":true,"aftertouch":false,"pitchBend":null,"supportedCC":[2]},"build":{"difficulty":"advanced","estimatedCost":null,"estimatedBuildTimeHours":null,"tools":["3D printer","soldering equipment"]},"resources":[{"kind":"repository","label":"GitHub repository","url":"https://github.com/glloq/servo-flute"}],"documentation":[{"kind":"readme","label":"Project README","url":"https://github.com/glloq/servo-flute/blob/main/README.md"}],"firmware":{"available":true,"buildSystems":["Arduino IDE"],"sourcePath":null,"environments":[]},"flash":{"supported":false,"targets":[]},"postFlash":{"localUrl":null,"setupSsidPattern":null,"steps":[]},"media":{"thumbnail":null,"images":[],"videos":[]},"relations":{"replaces":[],"replacedBy":["servo-flute-gmb"],"related":[]},"license":"MIT","warnings":["Legacy pre-GMB generation. Servo-Flute-GMB is the preferred modern project for new builds."]
}