{
  "id": "16-cords-lyre-midi",
  "name": "16 Cords Lyre MIDI",
  "shortName": "MIDI Lyre",
  "type": "legacy",
  "summary": "Finished 16-string lyre project using one servo per string, with Arduino Leonardo USB-MIDI and an ESP32 BLE-MIDI variant.",
  "description": "A compact robotic lyre where sixteen servos pluck sixteen individual strings. The repository explicitly describes the project as functional and finished.",
  "repository": {"owner":"glloq","name":"16-cords-lyre-midi","url":"https://github.com/glloq/16-cords-lyre-midi","visibility":"public"},
  "status": {"maturity":"validated","software":"tested","hardware":"tested","documentation":"documented","gmb":"unknown"},
  "families": ["plucked-string"],
  "supportedInstruments": ["lyre"],
  "controller": {"boardIds":["arduino-leonardo","esp32"],"notes":["Leonardo version uses USB MIDI.","ESP32 variant uses BLE MIDI."]},
  "midi": {"transports":[{"id":"usb-midi","status":"implemented","direction":"input"},{"id":"ble-midi","status":"implemented","direction":"input"}],"messages":["note-on","note-off"]},
  "gmb": {"state":"none","protocolVersion":null,"automaticDiscovery":false,"capabilityDescriptor":false,"changeNotification":false,"notes":["No GMB protocol implementation is documented in the repository."]},
  "mechanics": {"summary":"Sixteen servos individually pluck the sixteen strings of a physical lyre mounted on a wooden support.","axes":0,"requires3dPrinting":true,"requiresLaserCutting":null,"requiresCnc":null,"requiresWoodworking":true,"calibrationRequired":true,"homingRequired":false,"notes":["Printable parts are provided in the repository STL folder."]},
  "actuators": [{"typeId":"servo","quantity":16,"role":"Pluck individual lyre strings","driver":"PCA9685-compatible PWM servo driver","notes":null}],
  "drivers": ["PCA9685-compatible servo driver"],
  "sensors": [],
  "power": {"supplies":[{"label":"Servo supply","voltageV":5,"currentA":8,"notes":"Documented project supply."}],"notes":["Repository also documents a fused 230 V inlet feeding the low-voltage supply; mains wiring requires an appropriate enclosure and protection."]},
  "capabilities": {"noteRange":null,"polyphony":null,"velocity":false,"aftertouch":false,"pitchBend":false,"supportedCC":[]},
  "build": {"difficulty":"intermediate","estimatedCost":null,"estimatedBuildTimeHours":null,"tools":["3D printer","woodworking tools","soldering equipment"]},
  "resources": [{"kind":"repository","label":"GitHub repository","url":"https://github.com/glloq/16-cords-lyre-midi"},{"kind":"mechanics","label":"STL files","url":"https://github.com/glloq/16-cords-lyre-midi/tree/main/stl"}],
  "documentation": [{"kind":"readme","label":"Project README","url":"https://github.com/glloq/16-cords-lyre-midi/blob/main/README.md"}],
  "firmware": {"available":true,"buildSystems":["Arduino IDE"],"sourcePath":"arduino","environments":[]},
  "flash": {"supported":false,"targets":[]},
  "postFlash": {"localUrl":null,"setupSsidPattern":null,"steps":[]},
  "media": {"thumbnail":"https://raw.githubusercontent.com/glloq/16-cords-lyre-midi/main/lyre.jpg","images":[],"videos":[]},
  "relations": {"replaces":[],"replacedBy":[],"related":["servo-plucked-strings-gmb","playmode-gmb"]},
  "license": null,
  "warnings": ["Legacy project: preserved because the repository describes a completed physical build, but it does not implement GMB discovery."]
}