{
  "id":"solenoid-midi-music","name":"Solenoid MIDI Music","shortName":"Generic Solenoid MIDI","type":"legacy","summary":"Generic USB-MIDI controller concept for 1–128 solenoids with impulse, sustained and PWM velocity modes.","description":"An older generic actuator framework covering percussion impulses, sustained note activation and PWM-controlled velocity/hold power. It is useful as a reference for solenoid power-stage patterns and note mapping.","repository":{"owner":"glloq","name":"Solenoid-Midi-Music","url":"https://github.com/glloq/Solenoid-Midi-Music","visibility":"public"},"status":{"maturity":"legacy","software":"implemented","hardware":"unknown","documentation":"documented","gmb":"unknown"},"families":["generic","percussion","keyboard"],"supportedInstruments":["xylophone","glockenspiel","marimba","bells","generic-solenoid-instrument"],"controller":{"boardIds":[],"notes":["USB MIDI is documented; a final controller board is not asserted in the audited README excerpt."]},"midi":{"transports":[{"id":"usb-midi","status":"implemented","direction":"input"}],"messages":["note-on","note-off","velocity"]},"gmb":{"state":"none","protocolVersion":null,"automaticDiscovery":false,"capabilityDescriptor":false,"changeNotification":false,"notes":[]},"mechanics":{"summary":"One solenoid maps to one note. Three behaviours are documented: timed percussion impulse, sustained on/off, and PWM velocity/hold-power control.","axes":0,"requires3dPrinting":null,"requiresLaserCutting":null,"requiresCnc":null,"requiresWoodworking":null,"calibrationRequired":true,"homingRequired":false,"notes":["Supports chromatic or diatonic note mapping in the code design."]},"actuators":[{"typeId":"solenoid","quantity":null,"role":"Per-note actuation, from 1 up to 128 outputs","driver":"MCP23017/PCA9685 with ULN2803/ULN2804 or MOSFET power stage","notes":"PWM hold-power reduction is described for thermal management."}],"drivers":["MCP23017","PCA9685","ULN2803","ULN2804","MOSFET stages"],"sensors":[],"power":{"supplies":[],"notes":["Solenoid supply and protection must be sized for the selected actuators; flyback protection is required for MOSFET-driven coils."]},"capabilities":{"noteRange":null,"polyphony":null,"velocity":true,"aftertouch":false,"pitchBend":false,"supportedCC":[]},"build":{"difficulty":"advanced","estimatedCost":null,"estimatedBuildTimeHours":null,"tools":[]},"resources":[{"kind":"repository","label":"GitHub repository","url":"https://github.com/glloq/Solenoid-Midi-Music"}],"documentation":[{"kind":"readme","label":"Project README","url":"https://github.com/glloq/Solenoid-Midi-Music/blob/main/README.md"}],"firmware":{"available":true,"buildSystems":["Arduino IDE"],"sourcePath":null,"environments":[]},"flash":{"supported":false,"targets":[]},"postFlash":{"localUrl":null,"setupSsidPattern":null,"steps":[]},"media":{"thumbnail":null,"images":[],"videos":[]},"relations":{"replaces":[],"replacedBy":["playmode-gmb"],"related":["orchestrion-xylophone"]},"license":null,"warnings":["Legacy generic controller; use modern PlayMode GMB for new projects unless this reference architecture is specifically needed."]
}