{"id":"servo-plucked-strings-gmb","name":"Servo Plucked Strings GMB","shortName":null,"type":"instrument","summary":"ESP32 firmware for robotic plucked-string instruments using dedicated servo fingers and a plucking actuator.","description":null,"repository":{"owner":"glloq","name":"Servo-Plucked-Strings-GMB","url":"https://github.com/glloq/Servo-Plucked-Strings-GMB","visibility":"public"},"status":{"maturity":"bench-ready","software":"tested","hardware":"not-tested","documentation":"documented","gmb":"implemented"},"families":["plucked-string"],"supportedInstruments":["ukulele","guitar","bass","mandolin","banjo"],"controller":{"boardIds":["esp32-s3","esp32-wroom-32","esp32"],"notes":["README lists ESP32-S3-DevKitC-1, ESP32-WROOM-32 and ESP32 DevKit v1 profiles."]},"midi":{"transports":[{"id":"wifi-udp","status":"implemented","direction":"input","notes":"Default note transport uses UDP port 5006."},{"id":"web-ui","status":"implemented","direction":"input"},{"id":"sysex","status":"implemented","direction":"bidirectional","notes":"Used for GMB capability discovery."}],"messages":["note-on","note-off","control-change","sysex"]},"gmb":{"state":"native","protocolVersion":null,"automaticDiscovery":true,"capabilityDescriptor":true,"changeNotification":null,"notes":["README documents GMB SysEx discovery and capability reporting but the protocol version is not stated in the audited README excerpt."]},"mechanics":{"summary":"Each equipped fret has a dedicated servo finger; a separate servo plucks or strums each string. Optional geared fingers let one servo serve two fret positions.","axes":0,"requires3dPrinting":null,"requiresLaserCutting":null,"requiresCnc":null,"requiresWoodworking":null,"calibrationRequired":true,"homingRequired":false,"notes":["Supports 1 to 6 strings and arbitrary equipped frets."]},"actuators":[{"typeId":"servo","quantity":null,"role":"Fret fingers and pluck/strum actuation","driver":"PCA9685 or ESP32 LEDC","notes":"One or more PCA9685 boards can be used; direct GPIO servo outputs are also supported."}],"drivers":["PCA9685","ESP32 LEDC"],"sensors":[],"power":{"supplies":[],"notes":["Servo rail should use a separate 5-6 V supply sized for worst-case current; do not power servos from the ESP32 regulator."]},"capabilities":{"noteRange":null,"polyphony":6,"velocity":true,"aftertouch":false,"pitchBend":false,"supportedCC":[7,11,20,21,64,120,123]},"build":{"difficulty":null,"estimatedCost":null,"estimatedBuildTimeHours":null,"tools":[]},"resources":[{"kind":"repository","label":"GitHub repository","url":"https://github.com/glloq/Servo-Plucked-Strings-GMB"}],"documentation":[{"kind":"readme","label":"Project README","url":"https://github.com/glloq/Servo-Plucked-Strings-GMB/blob/main/README.md"},{"kind":"documentation","label":"Web interface","url":"https://github.com/glloq/Servo-Plucked-Strings-GMB/blob/main/docs/WEB_INTERFACE.md"},{"kind":"documentation","label":"Safety","url":"https://github.com/glloq/Servo-Plucked-Strings-GMB/blob/main/docs/SAFETY.md"},{"kind":"documentation","label":"MIDI protocol","url":"https://github.com/glloq/Servo-Plucked-Strings-GMB/blob/main/docs/MIDI_PROTOCOL.md"}],"firmware":{"available":true,"buildSystems":["PlatformIO","Arduino IDE"],"sourcePath":"firmware","environments":[]},"flash":{"supported":false,"targets":[]},"postFlash":{"localUrl":null,"setupSsidPattern":"Servo-Plucked-Strings-GMB","steps":["Restart the ESP32.","Connect to the instrument access point.","Open the device web interface.","Run the instrument wizard and calibrate every active fret finger.","Validate wiring and current limits before powered operation."]},"media":{"thumbnail":null,"images":[],"videos":[]},"relations":{"replaces":[],"replacedBy":[],"related":["general-midi-boop","stepper-plucked-strings-gmb"]},"license":"MIT","warnings":["Project documentation states that full physical instrument validation is still pending."]}
