{
  "id":"orchestrion-plucked-strings-solenoids","name":"Plucked Strings Solenoids","shortName":"Solenoid Plucked Strings","type":"legacy","summary":"Configurable USB-MIDI plucked-string architecture using solenoids for both fret actuation and alternating string plucking.","description":"An older generic guitar/ukulele/bass design built around MCP23017 I/O expansion and solenoid power stages. The repository explicitly says the code compiles but no hardware has been tested.","repository":{"owner":"glloq","name":"Orchestrion_Plucked_Strings_Solenoids","url":"https://github.com/glloq/Orchestrion_Plucked_Strings_Solenoids","visibility":"public"},"status":{"maturity":"legacy","software":"implemented","hardware":"not-tested","documentation":"documented","gmb":"unknown"},"families":["plucked-string"],"supportedInstruments":["guitar","bass","ukulele","generic-plucked-string"],"controller":{"boardIds":[],"notes":["USB MIDI is documented; the audited README does not assert a final board model."]},"midi":{"transports":[{"id":"usb-midi","status":"implemented","direction":"input"}],"messages":["note-on","note-off"]},"gmb":{"state":"none","protocolVersion":null,"automaticDiscovery":false,"capabilityDescriptor":false,"changeNotification":false,"notes":[]},"mechanics":{"summary":"Solenoid fingers pull strings toward frets; two opposed solenoids per string alternate plucking direction and can damp the string when released.","axes":0,"requires3dPrinting":null,"requiresLaserCutting":null,"requiresCnc":null,"requiresWoodworking":true,"calibrationRequired":true,"homingRequired":false,"notes":["Repository emphasizes damping mechanical noise and reducing coil hold power to manage heat."]},"actuators":[{"typeId":"solenoid","quantity":null,"role":"Fret fingers and dual-solenoid plucking","driver":"MCP23017 + ULN2803 or MOSFET stages","notes":"Example configuration uses 12 fret solenoids plus two pluck solenoids per string."}],"drivers":["MCP23017","ULN2803","MOSFET stages"],"sensors":[],"power":{"supplies":[],"notes":["Thermal management is mandatory; repository calls for reduced hold voltage/PWM after activation."]},"capabilities":{"noteRange":null,"polyphony":null,"velocity":false,"aftertouch":false,"pitchBend":false,"supportedCC":[]},"build":{"difficulty":"advanced","estimatedCost":null,"estimatedBuildTimeHours":null,"tools":["woodworking tools","soldering equipment"]},"resources":[{"kind":"repository","label":"GitHub repository","url":"https://github.com/glloq/Orchestrion_Plucked_Strings_Solenoids"}],"documentation":[{"kind":"readme","label":"Project README","url":"https://github.com/glloq/Orchestrion_Plucked_Strings_Solenoids/blob/main/README.md"}],"firmware":{"available":true,"buildSystems":["Arduino IDE"],"sourcePath":null,"environments":[]},"flash":{"supported":false,"targets":[]},"postFlash":{"localUrl":null,"setupSsidPattern":null,"steps":[]},"media":{"thumbnail":null,"images":[],"videos":[]},"relations":{"replaces":[],"replacedBy":[],"related":["servo-plucked-strings-gmb","solenoid-midi-music","ukuletron"]},"license":null,"warnings":["Repository explicitly states that the code compiles but the physical system has not been tested.","Solenoid heating and hold-power reduction remain important unresolved physical concerns."]
}