{"id":"servo-melodica-gmb","name":"Servo Melodica GMB","shortName":null,"type":"instrument","summary":"ESP32 controller that presses melodica keys with servos and manages configurable airflow systems.","description":null,"repository":{"owner":"glloq","name":"servo-Melodica-GMB","url":"https://github.com/glloq/servo-Melodica-GMB","visibility":"public"},"status":{"maturity":"software-ready","software":"tested","hardware":"not-tested","documentation":"documented","gmb":"planned"},"families":["keyboard","wind"],"supportedInstruments":["melodica"],"controller":{"boardIds":["esp32","esp32-s2","esp32-s3"],"notes":["README documents classic ESP32, ESP32-S2 and ESP32-S3 build profiles."]},"midi":{"transports":[{"id":"ble-midi","status":"implemented","direction":"input"},{"id":"rtp-midi","status":"implemented","direction":"input"},{"id":"din-midi","status":"implemented","direction":"input"},{"id":"usb-midi","status":"implemented","direction":"input","notes":"Native USB MIDI only on ESP32-S2/S3."},{"id":"serial-midi","status":"implemented","direction":"input"}],"messages":["note-on","note-off","control-change"]},"gmb":{"state":"planned","protocolVersion":null,"automaticDiscovery":null,"capabilityDescriptor":null,"changeNotification":null,"notes":["General-Midi-Boop currently lists this project in its 'soon to come' compatibility section; the audited Melodica README does not yet document GMB discovery."]},"mechanics":{"summary":"Up to 64 servo-driven keys are combined with one of several runtime-selectable airflow systems including valves, blowers, pumps or stepper bellows.","axes":null,"requires3dPrinting":null,"requiresLaserCutting":null,"requiresCnc":null,"requiresWoodworking":null,"calibrationRequired":true,"homingRequired":false,"notes":[]},"actuators":[{"typeId":"servo","quantity":null,"role":"Press melodica keys","driver":"PCA9685","notes":"Up to 64 keys across up to four PCA9685 boards."},{"typeId":"solenoid","quantity":null,"role":"Optional airflow valve","driver":null,"notes":null},{"typeId":"blower","quantity":null,"role":"Optional air source","driver":null,"notes":null},{"typeId":"pump","quantity":null,"role":"Optional air source","driver":null,"notes":null},{"typeId":"stepper","quantity":null,"role":"Optional motorised bellows","driver":null,"notes":null}],"drivers":["PCA9685","H-bridge"],"sensors":["pressure sensor (optional)"],"power":{"supplies":[],"notes":[]},"capabilities":{"noteRange":null,"polyphony":null,"velocity":true,"aftertouch":false,"pitchBend":false,"supportedCC":[7,11]},"build":{"difficulty":null,"estimatedCost":null,"estimatedBuildTimeHours":null,"tools":[]},"resources":[{"kind":"repository","label":"GitHub repository","url":"https://github.com/glloq/servo-Melodica-GMB"}],"documentation":[{"kind":"readme","label":"Project README","url":"https://github.com/glloq/servo-Melodica-GMB/blob/main/README.md"},{"kind":"documentation","label":"Wiring","url":"https://github.com/glloq/servo-Melodica-GMB/blob/main/docs/WIRING.md"}],"firmware":{"available":true,"buildSystems":["PlatformIO","Arduino IDE"],"sourcePath":"ServoMelodica","environments":["esp32_ble_servo_air","esp32_wifi_servo_air","esp32_din_servo_air","esp32_serial_servo_air","esp32s3_usb_servo_air"]},"flash":{"supported":false,"targets":[]},"postFlash":{"localUrl":null,"setupSsidPattern":"ServoMelodica-Setup","steps":["Restart the ESP32.","Long-press BOOT when setup hotspot mode is required.","Connect to ServoMelodica-Setup.","Open http://192.168.4.1/.","Configure keys, MIDI transport and air system, then calibrate each key."]},"media":{"thumbnail":null,"images":[],"videos":[]},"relations":{"replaces":[],"replacedBy":[],"related":["general-midi-boop","servo-flute-gmb"]},"license":null,"warnings":["Current GMB integration is classified as planned until the instrument repository itself documents and tests the discovery protocol."]}
