{"id":"slide-whistle-gmb","name":"Slide Whistle GMB","shortName":null,"type":"instrument","summary":"MIDI-controlled slide whistle project with stepper pitch positioning, configurable air systems and an ESP32 GMB controller.","description":null,"repository":{"owner":"glloq","name":"slide_Whistle-GMB","url":"https://github.com/glloq/slide_Whistle-GMB","visibility":"public"},"status":{"maturity":"software-ready","software":"implemented","hardware":"partial","documentation":"documented","gmb":"implemented"},"families":["wind"],"supportedInstruments":["slide-whistle"],"controller":{"boardIds":["esp32","arduino-leonardo","arduino-micro"],"notes":["Repository contains legacy Arduino builds plus a newer ESP32 universal controller."]},"midi":{"transports":[{"id":"usb-midi","status":"implemented","direction":"input","notes":"Legacy Arduino Leonardo/Micro versions use MIDIUSB."},{"id":"sysex","status":"implemented","direction":"bidirectional","notes":"ESP32 controller implements GMB v2 recognition."}],"messages":["note-on","note-off","pitch-bend","aftertouch","control-change","sysex"]},"gmb":{"state":"native","protocolVersion":2,"automaticDiscovery":true,"capabilityDescriptor":true,"changeNotification":null,"notes":["GMB v2 applies to the ESP32 controller; legacy Arduino versions are separate older implementations."]},"mechanics":{"summary":"A stepper motor positions the whistle slide using a calibrated note-position lookup table while either a fan+servo or solenoid+servo chain controls airflow.","axes":1,"requires3dPrinting":null,"requiresLaserCutting":null,"requiresCnc":null,"requiresWoodworking":null,"calibrationRequired":true,"homingRequired":true,"notes":["README documents a typical 300 mm slider travel and a note-by-note LUT calibration workflow for legacy builds."]},"actuators":[{"typeId":"stepper","quantity":1,"role":"Move the slide to pitch","driver":"A4988 or DRV8825 on legacy design","notes":null},{"typeId":"servo","quantity":1,"role":"Direct or regulate airflow","driver":null,"notes":null},{"typeId":"blower","quantity":null,"role":"Optional fan-based air source","driver":null,"notes":null},{"typeId":"solenoid","quantity":null,"role":"Optional compressed-air valve","driver":null,"notes":null}],"drivers":["A4988","DRV8825"],"sensors":["normally-closed end stop"],"power":{"supplies":[{"label":"Legacy motion/air supply","voltageV":12,"currentA":null,"notes":"README suggests 12 V 2-3 A for the minimal legacy hardware."}],"notes":[]},"capabilities":{"noteRange":{"min":48,"max":84},"polyphony":1,"velocity":true,"aftertouch":true,"pitchBend":true,"supportedCC":[1]},"build":{"difficulty":"advanced","estimatedCost":{"currency":"EUR","min":100,"max":130,"notes":"README comparison quotes roughly €100 for fan and €130 for solenoid legacy variants."},"estimatedBuildTimeHours":null,"tools":[]},"resources":[{"kind":"repository","label":"GitHub repository","url":"https://github.com/glloq/slide_Whistle-GMB"},{"kind":"bom","label":"Components list","url":"https://github.com/glloq/slide_Whistle-GMB/blob/main/COMPONENTS_LIST.md"}],"documentation":[{"kind":"readme","label":"Project README","url":"https://github.com/glloq/slide_Whistle-GMB/blob/main/README.md"},{"kind":"documentation","label":"Installation","url":"https://github.com/glloq/slide_Whistle-GMB/blob/main/INSTALLATION.md"},{"kind":"documentation","label":"ESP32 architecture","url":"https://github.com/glloq/slide_Whistle-GMB/blob/main/esp32/ARCHITECTURE.md"},{"kind":"documentation","label":"GMB v2 protocol","url":"https://github.com/glloq/slide_Whistle-GMB/blob/main/esp32/GMB_PROTOCOL.md"}],"firmware":{"available":true,"buildSystems":["PlatformIO","Arduino IDE"],"sourcePath":".","environments":[]},"flash":{"supported":false,"targets":[]},"postFlash":{"localUrl":null,"setupSsidPattern":null,"steps":[]},"media":{"thumbnail":null,"images":[],"videos":[]},"relations":{"replaces":[],"replacedBy":[],"related":["general-midi-boop","servo-flute-gmb"]},"license":"MIT","warnings":["The ESP32 controller is explicitly marked as not hardware-validated; older Arduino versions coexist in the same repository."]}
