{
  "id": "orchestrion-piano",
  "name": "Orchestrion Piano",
  "shortName": "Solenoid Piano",
  "type": "legacy",
  "summary": "Arduino-based acoustic piano concept using PWM-controlled solenoids for up to 88 keys and servos for pedals.",
  "description": "The repository documents a configurable full-piano architecture and compiles, but explicitly states that it has not been physically tested.",
  "repository": {"owner":"glloq","name":"Orchestrion_Piano","url":"https://github.com/glloq/Orchestrion_Piano","visibility":"public"},
  "status": {"maturity":"legacy","software":"implemented","hardware":"not-tested","documentation":"documented","gmb":"unknown"},
  "families": ["keyboard"],
  "supportedInstruments": ["piano"],
  "controller": {"boardIds":["arduino-leonardo"],"notes":["README describes an Arduino receiving MIDI over USB; exact board variant should be confirmed before construction."]},
  "midi": {"transports":[{"id":"usb-midi","status":"implemented","direction":"input"}],"messages":["note-on","note-off","velocity"]},
  "gmb": {"state":"none","protocolVersion":null,"automaticDiscovery":false,"capabilityDescriptor":false,"changeNotification":false,"notes":[]},
  "mechanics": {"summary":"One solenoid is mounted under each piano key for direct actuation; three higher-torque servo mechanisms are proposed for the pedals.","axes":0,"requires3dPrinting":null,"requiresLaserCutting":null,"requiresCnc":null,"requiresWoodworking":true,"calibrationRequired":true,"homingRequired":false,"notes":["README notes that key weighting may need mechanical adjustment."]},
  "actuators": [{"typeId":"solenoid","quantity":88,"role":"Actuate piano keys","driver":"PCA9685 + power MOSFET stages","notes":"Count represents the full 88-key target."},{"typeId":"servo","quantity":3,"role":"Operate piano pedals","driver":null,"notes":"Pedal mechanics are proposed rather than validated."}],
  "drivers": ["PCA9685","MOSFET stages"],
  "sensors": [],
  "power": {"supplies":[{"label":"Solenoid supply","voltageV":24,"currentA":null,"notes":"README suggests 24 V solenoids around 5-7 N; supply architecture must be sized to the actual solenoids and concurrency."}],"notes":["High-current design; repository stresses fusing/protection and current distribution across multiple supplies."]},
  "capabilities": {"noteRange":{"min":21,"max":108},"polyphony":null,"velocity":true,"aftertouch":false,"pitchBend":false,"supportedCC":[]},
  "build": {"difficulty":"expert","estimatedCost":null,"estimatedBuildTimeHours":null,"tools":["woodworking tools","soldering equipment"]},
  "resources": [{"kind":"repository","label":"GitHub repository","url":"https://github.com/glloq/Orchestrion_Piano"}],
  "documentation": [{"kind":"readme","label":"Project README","url":"https://github.com/glloq/Orchestrion_Piano/blob/main/README.md"}],
  "firmware": {"available":true,"buildSystems":["Arduino IDE"],"sourcePath":null,"environments":[]},
  "flash": {"supported":false,"targets":[]},
  "postFlash": {"localUrl":null,"setupSsidPattern":null,"steps":[]},
  "media": {"thumbnail":null,"images":[],"videos":[]},
  "relations": {"replaces":[],"replacedBy":[],"related":["playmode-gmb"]},
  "license": null,
  "warnings": ["Repository explicitly states that the code compiles but no hardware has been tested.","High-current mains-powered build requires appropriate electrical protection and enclosure design."]
}