{
  "id":"continuous-pluck-stepper","name":"Continuous Pluck Stepper","shortName":"Continuous Pluck Stepper","type":"legacy","summary":"Arduino-based moving-finger architecture for plucked strings using steppers, end stops and servo finger/pluck mechanisms.","description":"An exploratory predecessor to the modern Stepper Plucked Strings GMB architecture, designed for ukulele, guitar, bass and similar instruments.","repository":{"owner":"glloq","name":"Continuous_PluckStepper","url":"https://github.com/glloq/Continuous_PluckStepper","visibility":"public"},"status":{"maturity":"legacy","software":"partial","hardware":"unknown","documentation":"documented","gmb":"unknown"},"families":["plucked-string"],"supportedInstruments":["ukulele","guitar","bass","generic-plucked-string"],"controller":{"boardIds":[],"notes":["Repository describes an Arduino-based design but does not assert a final controller board in the audited README."]},"midi":{"transports":[],"messages":["note-on","note-off"]},"gmb":{"state":"none","protocolVersion":null,"automaticDiscovery":false,"capabilityDescriptor":false,"changeNotification":false,"notes":[]},"mechanics":{"summary":"A stepper moves a note-position carriage. The string can use a continuous-contact slide or a servo-lowered finger; a similar servo mechanism plucks the string.","axes":null,"requires3dPrinting":null,"requiresLaserCutting":null,"requiresCnc":null,"requiresWoodworking":null,"calibrationRequired":true,"homingRequired":true,"notes":["Per-string configuration includes fret count, steps, direction, end stop and finger/pluck servo positions."]},"actuators":[{"typeId":"stepper","quantity":null,"role":"Move note-position carriage","driver":null,"notes":null},{"typeId":"servo","quantity":null,"role":"Finger and pluck actuation","driver":"PCA9685","notes":null}],"drivers":["PCA9685"],"sensors":["end stops"],"power":{"supplies":[],"notes":[]},"capabilities":{"noteRange":null,"polyphony":null,"velocity":null,"aftertouch":false,"pitchBend":false,"supportedCC":[]},"build":{"difficulty":"advanced","estimatedCost":null,"estimatedBuildTimeHours":null,"tools":[]},"resources":[{"kind":"repository","label":"GitHub repository","url":"https://github.com/glloq/Continuous_PluckStepper"}],"documentation":[{"kind":"readme","label":"Project README","url":"https://github.com/glloq/Continuous_PluckStepper/blob/main/README.md"}],"firmware":{"available":true,"buildSystems":["Arduino IDE"],"sourcePath":null,"environments":[]},"flash":{"supported":false,"targets":[]},"postFlash":{"localUrl":null,"setupSsidPattern":null,"steps":[]},"media":{"thumbnail":null,"images":[],"videos":[]},"relations":{"replaces":[],"replacedBy":["stepper-plucked-strings-gmb"],"related":["stepper-midi-4-cords-instrument"]},"license":null,"warnings":["Legacy exploratory architecture; modern Stepper Plucked Strings GMB is the preferred implementation for new builds."]
}