{"id":"orchestrion-trumpet","name":"Orchestrion Trumpet","shortName":null,"type":"instrument","summary":"Electro-acoustic ESP32 MIDI trumpet that drives a loudspeaker into a real trumpet resonator and optionally actuates its valves.","description":null,"repository":{"owner":"glloq","name":"Orchestrion_trumpet","url":"https://github.com/glloq/Orchestrion_trumpet","visibility":"public"},"status":{"maturity":"bench-ready","software":"tested","hardware":"not-tested","documentation":"documented","gmb":"planned"},"families":["brass"],"supportedInstruments":["trumpet"],"controller":{"boardIds":["esp32-s3","esp32-wroom-32"],"notes":["README documents ESP32-S3 and ESP32-WROOM-32 variants, including 4 MB and 8 MB WROOM environments."]},"midi":{"transports":[{"id":"usb-midi","status":"implemented","direction":"bidirectional","notes":"ESP32-S3 only."},{"id":"ble-midi","status":"implemented","direction":"bidirectional"},{"id":"rtp-midi","status":"implemented","direction":"bidirectional"},{"id":"din-midi","status":"implemented","direction":"bidirectional"},{"id":"web-ui","status":"implemented","direction":"bidirectional"}],"messages":["note-on","note-off","control-change"]},"gmb":{"state":"planned","protocolVersion":null,"automaticDiscovery":null,"capabilityDescriptor":null,"changeNotification":null,"notes":["The project belongs to the GMB ecosystem, but the audited README does not document the GMB discovery protocol; General-Midi-Boop currently lists trumpet integration under 'soon to come'."]},"mechanics":{"summary":"A speaker in a sealed chamber acoustically excites the real trumpet leadpipe while one to four optional servo or solenoid actuators move valves for physical behaviour and presentation.","axes":0,"requires3dPrinting":null,"requiresLaserCutting":null,"requiresCnc":null,"requiresWoodworking":true,"calibrationRequired":true,"homingRequired":false,"notes":["The acoustic chamber and speaker coupling are core mechanical/acoustic parts of the build."]},"actuators":[{"typeId":"speaker","quantity":1,"role":"Excite the trumpet acoustically","driver":"I2S DAC / amplifier chain","notes":null},{"typeId":"servo","quantity":null,"role":"Optional trumpet valve actuation","driver":"LEDC or PCA9685","notes":"One to four valves can each independently use servo actuation."},{"typeId":"solenoid","quantity":null,"role":"Optional trumpet valve actuation","driver":"logic-level MOSFET","notes":"One to four valves can each independently use solenoid actuation."}],"drivers":["PCM5102A","MAX98357A","TPA3118D2","PCA9685","logic-level MOSFET"],"sensors":[],"power":{"supplies":[],"notes":["Servo and solenoid loads require separate actuator power; project safety documentation requires flyback protection, fusing and a physical emergency stop."]},"capabilities":{"noteRange":null,"polyphony":1,"velocity":true,"aftertouch":null,"pitchBend":null,"supportedCC":[]},"build":{"difficulty":null,"estimatedCost":null,"estimatedBuildTimeHours":null,"tools":[]},"resources":[{"kind":"repository","label":"GitHub repository","url":"https://github.com/glloq/Orchestrion_trumpet"},{"kind":"bom","label":"Bill of materials","url":"https://github.com/glloq/Orchestrion_trumpet/blob/main/docs/BOM.md"}],"documentation":[{"kind":"readme","label":"Project README","url":"https://github.com/glloq/Orchestrion_trumpet/blob/main/README.md"},{"kind":"documentation","label":"Hardware","url":"https://github.com/glloq/Orchestrion_trumpet/blob/main/docs/HARDWARE.md"},{"kind":"documentation","label":"Audio","url":"https://github.com/glloq/Orchestrion_trumpet/blob/main/docs/AUDIO.md"},{"kind":"documentation","label":"MIDI","url":"https://github.com/glloq/Orchestrion_trumpet/blob/main/docs/MIDI.md"}],"firmware":{"available":true,"buildSystems":["PlatformIO"],"sourcePath":".","environments":["esp32-s3-devkitc","esp32dev","esp32dev_8mb"]},"flash":{"supported":false,"targets":[]},"postFlash":{"localUrl":"http://midi-trumpet.local","setupSsidPattern":"MIDI-Trumpet-XXXX","steps":["Restart the board.","Connect to the generated MIDI-Trumpet hotspot.","Open http://192.168.4.1.","Complete the setup wizard for board, audio chain, valves, MIDI and calibration."]},"media":{"thumbnail":null,"images":[],"videos":[]},"relations":{"replaces":[],"replacedBy":[],"related":["general-midi-boop"]},"license":null,"warnings":["Project documentation explicitly states that software is ahead of hardware and the remaining work is physical bench validation."]}
